{
  "schemaVersion": "0.1.0-pilot",
  "semanticOwner": "math-research-module",
  "namespace": "mred",
  "registryScope": "module-local-pilot",
  "coverage": {
    "fixtureCount": 3,
    "realLearnersDiagnosed": 0,
    "full105TypesDiagnosed": false
  },
  "authority": {
    "nativePermissionGranted": false,
    "actualAcceptanceInferred": false,
    "grantsExecution": false
  },
  "revisions": [
    {
      "id": "mred:00000000-0000-4000-8000-000000000001",
      "version": 1,
      "type": "concept_family",
      "classification": {
        "label": "수학적 대상과 과제",
        "semanticPath": [
          "DATA",
          "concept_family",
          "수학적 대상과 과제"
        ]
      },
      "core": {
        "statement": "자료·개념·맥락 과제의 module-local 분류",
        "epistemicStatus": "definition",
        "evidenceRefs": [],
        "sourceRefs": [],
        "targetRefs": [],
        "probeRefs": [],
        "limitations": [],
        "synthetic": true,
        "details": {}
      },
      "layer": "DATA",
      "semanticCoreHash": "95a8190b67913e32ffaf55addb1b93216bd0dfd3a4b6b09ad7f9ae3423eafe32",
      "revisionHash": "aad62497eb620c967435ccc7847ad4e44adb26ac1edc217edc4bbfb95699f815"
    },
    {
      "id": "mred:00000000-0000-4000-8000-000000000002",
      "version": 1,
      "type": "reasoning_family",
      "classification": {
        "label": "근거 기반 추론",
        "semanticPath": [
          "LOGIC",
          "reasoning_family",
          "근거 기반 추론"
        ]
      },
      "core": {
        "statement": "관찰에서 제한된 주장과 검증 가능한 가설로 이어지는 추론",
        "epistemicStatus": "definition",
        "evidenceRefs": [],
        "sourceRefs": [],
        "targetRefs": [],
        "probeRefs": [],
        "limitations": [],
        "synthetic": true,
        "details": {}
      },
      "layer": "LOGIC",
      "semanticCoreHash": "946af36556f21237b254f30f326a14a8bd2915bc6487eae0ebab90a50298ac52",
      "revisionHash": "a45c03a8bafb42d5946fb89aa827143a5813409eb7539b49557a97360468ea51"
    },
    {
      "id": "mred:00000000-0000-4000-8000-000000000003",
      "version": 1,
      "type": "action_family",
      "classification": {
        "label": "탐색 및 교수 행위",
        "semanticPath": [
          "ACTION",
          "action_family",
          "탐색 및 교수 행위"
        ]
      },
      "core": {
        "statement": "행동 정의와 실제 실행 기록을 별도 identity로 구분",
        "epistemicStatus": "definition",
        "evidenceRefs": [],
        "sourceRefs": [],
        "targetRefs": [],
        "probeRefs": [],
        "limitations": [],
        "synthetic": true,
        "details": {}
      },
      "layer": "ACTION",
      "semanticCoreHash": "3c6f4c76c60ed87d6c90fd09f0df0c884aea24fbc22c6fe360d5e37608103653",
      "revisionHash": "720d1fe342cef5b15bd48cadf072b11f94a23f5d38095e655303783bb1712d50"
    },
    {
      "id": "mred:00000000-0000-4000-8000-000000000004",
      "version": 1,
      "type": "governance_family",
      "classification": {
        "label": "출처와 검토",
        "semanticPath": [
          "GOVERNANCE",
          "governance_family",
          "출처와 검토"
        ]
      },
      "core": {
        "statement": "출처·검토·수락·권한 정책은 별개의 기록",
        "epistemicStatus": "definition",
        "evidenceRefs": [],
        "sourceRefs": [],
        "targetRefs": [],
        "probeRefs": [],
        "limitations": [],
        "synthetic": true,
        "details": {}
      },
      "layer": "GOVERNANCE",
      "semanticCoreHash": "6ef1bc46bd79b8e3856671ad991ade5c76f15886e55cc0e8346339093b2c5b28",
      "revisionHash": "665dfd1af5ed97430d53210e33803374b9c877c74d45be74037bde6ee8be8114"
    },
    {
      "id": "mred:00000000-0000-4000-8000-000000000005",
      "version": 1,
      "type": "source_document",
      "classification": {
        "label": "합성 관찰 fixture",
        "semanticPath": [
          "DATA",
          "source_document",
          "합성 관찰 fixture"
        ]
      },
      "core": {
        "statement": "자동 검증용 가상 사례 3개. 실제 학생 기록이 아니다.",
        "epistemicStatus": "recorded",
        "evidenceRefs": [],
        "sourceRefs": [],
        "targetRefs": [],
        "probeRefs": [],
        "limitations": [],
        "synthetic": true,
        "details": {
          "sourcePath": "samples/synthetic-observations.json",
          "sha256": "9af6ae7199d012f1ea2395a2c6653b5f53d8f7b4ad254925e3c01975080675b2",
          "synthetic": true
        }
      },
      "layer": "DATA",
      "semanticCoreHash": "7e8f7bc5a38c8fd0b23b4ac2c344843144ad082760b206af4aef23e6a4c20d0b",
      "revisionHash": "587102960c7a6eaee955335e41e799570afae70b2d8ba603fd7c9a79f1d93b37"
    },
    {
      "id": "mred:00000000-0000-4000-8000-000000000006",
      "version": 1,
      "type": "source_document",
      "classification": {
        "label": "HM11-d3-T02 원 설계자료",
        "semanticPath": [
          "DATA",
          "source_document",
          "HM11-d3-T02 원 설계자료"
        ]
      },
      "core": {
        "statement": "사용자가 제공한 연구 설계 원문. 학습효과나 인지구인 검증 자료로 간주하지 않는다.",
        "epistemicStatus": "recorded",
        "evidenceRefs": [],
        "sourceRefs": [],
        "targetRefs": [],
        "probeRefs": [],
        "limitations": [],
        "synthetic": false,
        "details": {
          "sourcePath": "../../source/archive/research_review/multiplication_designs.json",
          "sha256": "88d3c74c8c1427c0a72dd95416faeb126d3de77e699293b8e630ede05d7ffd05",
          "jsonPointer": "/HM11-d3-T02",
          "legacyId": "HM11-d3-T02"
        }
      },
      "layer": "DATA",
      "semanticCoreHash": "e27205b1d30deb13502ed906c59ade3dc946ebe55db138e0b9f92eb6130b7873",
      "revisionHash": "380c7cbc89e57d0f8f23a3296b5cb1036af1d1e4ed697359c08a9c03fe2bfea6"
    },
    {
      "id": "mred:00000000-0000-4000-8000-000000000007",
      "version": 1,
      "type": "source_claim",
      "classification": {
        "label": "HM11-d3-T02 설계 의도",
        "semanticPath": [
          "GOVERNANCE",
          "source_claim",
          "HM11-d3-T02 설계 의도"
        ]
      },
      "core": {
        "statement": "같은 배수를 모든 분할 항에 적용하는 분배 구조를 식으로 표현한다.",
        "epistemicStatus": "reported",
        "evidenceRefs": [],
        "sourceRefs": [
          {
            "id": "mred:00000000-0000-4000-8000-000000000006",
            "version": 1
          }
        ],
        "targetRefs": [],
        "probeRefs": [],
        "limitations": [
          "프로젝트 저작 설계 의도이며 원저자 인증·학습효과·잠재능력 구인 타당화를 의미하지 않는다."
        ],
        "synthetic": false,
        "details": {}
      },
      "layer": "GOVERNANCE",
      "semanticCoreHash": "bcea0661bd7d24fbc931c9b824c90c4902aa9c92202d83f4238f8e27336e8bbf",
      "revisionHash": "1f4f59d20aa313e47f08bd695f464fb993261c238e4be90f000f2a41df27bbb0"
    },
    {
      "id": "mred:00000000-0000-4000-8000-000000000008",
      "version": 1,
      "type": "atomic_concept",
      "classification": {
        "label": "분배와 전체 양 보존",
        "semanticPath": [
          "DATA",
          "atomic_concept",
          "분배와 전체 양 보존"
        ]
      },
      "core": {
        "statement": "분배와 전체 양 보존을 이번 module-local 분석에서 하나의 개념 단위로 다룬다.",
        "epistemicStatus": "definition",
        "evidenceRefs": [],
        "sourceRefs": [],
        "targetRefs": [],
        "probeRefs": [],
        "limitations": [],
        "synthetic": true,
        "details": {}
      },
      "layer": "DATA",
      "semanticCoreHash": "1f8fe89fe27a3927f697a56c93bb801802c8c90fabd6591ef48f25ae073a6b16",
      "revisionHash": "ea4bc8bebd0ba3423915d982a5ddde6d056494d1426f549510b91b7b7964509b"
    },
    {
      "id": "mred:00000000-0000-4000-8000-000000000009",
      "version": 1,
      "type": "contextual_unit",
      "classification": {
        "label": "분배와 전체 양 보존 맥락 단위",
        "semanticPath": [
          "DATA",
          "contextual_unit",
          "분배와 전체 양 보존 맥락 단위"
        ]
      },
      "core": {
        "statement": "개념·표상·조건·과제의 결합. 개념 자체와 다른 identity다.",
        "epistemicStatus": "definition",
        "evidenceRefs": [],
        "sourceRefs": [],
        "targetRefs": [],
        "probeRefs": [],
        "limitations": [],
        "synthetic": true,
        "details": {}
      },
      "layer": "DATA",
      "semanticCoreHash": "7c1f80a1532d117c47f286140d2f7b9f2ce9caef96de847f9389e4fa5cbdaf67",
      "revisionHash": "ec228c2da58f2e2dbdadb080dc00ab79ff94cd4a76911899ca99d4173795d0b8"
    },
    {
      "id": "mred:00000000-0000-4000-8000-00000000000a",
      "version": 1,
      "type": "item",
      "classification": {
        "label": "synthetic-multiplication",
        "semanticPath": [
          "DATA",
          "item",
          "synthetic-multiplication"
        ]
      },
      "core": {
        "statement": "24×3을 (20+4)×3으로 나누어 설명하시오.",
        "epistemicStatus": "definition",
        "evidenceRefs": [],
        "sourceRefs": [
          {
            "id": "mred:00000000-0000-4000-8000-000000000006",
            "version": 1
          }
        ],
        "targetRefs": [],
        "probeRefs": [],
        "limitations": [],
        "synthetic": true,
        "details": {
          "adaptedFromLegacyId": "HM11-d3-T02",
          "exactCopy": false
        }
      },
      "layer": "DATA",
      "semanticCoreHash": "d4980f7ba775a4c5668b9db6fa35939915d0f8563d6ac389f0fe36afe30d7b89",
      "revisionHash": "ea8b6d650130f7dc952d3160f64f2eb460a9de75e7df3588717a8c22bd20ba77"
    },
    {
      "id": "mred:00000000-0000-4000-8000-00000000000b",
      "version": 1,
      "type": "observation",
      "classification": {
        "label": "synthetic-multiplication 최초 관찰",
        "semanticPath": [
          "DATA",
          "observation",
          "synthetic-multiplication 최초 관찰"
        ]
      },
      "core": {
        "statement": "가상의 학습자가 20×3+4×3=72를 쓰고 두 부분 모두 세 배라고 말했다.",
        "epistemicStatus": "observed",
        "evidenceRefs": [],
        "sourceRefs": [
          {
            "id": "mred:00000000-0000-4000-8000-000000000005",
            "version": 1
          }